{
  "schemaVersion": 1,
  "name": "shinny-button",
  "framework": "svelte",
  "entry": "shinny-button.svelte",
  "export": "default",
  "files": [
    "shinny-button.svelte",
    "spark.svg",
    "button.css"
  ],
  "dependencies": {},
  "props": [
    {
      "name": "label",
      "type": "string",
      "required": false,
      "description": "Button text.",
      "default": "'Make it shine'"
    },
    {
      "name": "disabled",
      "type": "boolean",
      "required": false,
      "default": "false"
    }
  ]
}
